{
  "@context": "https://www.3se.info/3se-onto/contexts/property.context.jsonld",
  "@type": "rdf:Property",
  "title": "location of - RO",
  "description": "A relation between two independent continuants, the location and the target, in which the target is entirely within the location.",
  "isReferencedBy": [
    "https://www.3se.info/3se-onto/references/ro-2025-12"
  ],
  "status": "standard"
}
