{
  "@context": "https://www.3se.info/3se-onto/contexts/property.context.jsonld",
  "@type": "rdf:Property",
  "title": "consumes - 3SE",
  "description": "Relates an element to an input element that it utilizes during its execution.",
  "subPropertyOf": [
    "https://www.3se.info/3se-onto/properties/used-w3c-prov-2013"
  ],
  "domain": "skos:Concept",
  "range": "skos:Concept",
  "status": "draft"
}
