{
  "@context": "https://www.3se.info/3se-onto/contexts/property.context.jsonld",
  "@type": "rdf:Property",
  "title": "activates - 3SE",
  "description": "Relates a milieu to the context it activates by providing the set of actors and systems from which the context emerges.",
  "domain": "https://www.3se.info/3se-onto/terms/milieu-3se-069c1b6f06a77b34",
  "range": "https://www.3se.info/3se-onto/terms/context-3se-069c1b6f066d7c1e",
  "status": "draft"
}
