{
  "@context": "https://www.3se.info/3se-onto/contexts/property.context.jsonld",
  "@type": "rdf:Property",
  "title": "elicits - 3SE",
  "description": "Relates an event to the exchange it causally brings about at a system boundary. Grounded in BFO as a causal relation between a Process (event) and a Generically Dependent Continuant (exchange).",
  "domain": "skos:Concept",
  "range": "https://www.3se.info/3se-onto/terms/exchange-3se-069bc4ea5316749f",
  "status": "draft"
}
