{
  "@context": "https://www.3se.info/3se-onto/contexts/property.context.jsonld",
  "@type": "rdf:Property",
  "title": "composite aggregation - UML 2.5.1",
  "description": "Composite aggregation is a strong form of aggregation that requires a part object be included in at most one composite object at a time. If a composite object is deleted, all of its part instances that are objects are deleted with it.",
  "isReferencedBy": [
    "https://www.3se.info/3se-onto/references/uml-spec-2-5-1-069c841060fd70b4"
  ],
  "status": "standard",
  "@id": "https://www.3se.info/3se-onto/properties/composite-aggregation-uml-spec-2-5-1-069c841061257798",
  "entryCreated": "2026-03-28",
  "entryModified": "2026-03-28",
  "entryCreator": {
    "@type": "foaf:Person",
    "name": "@rcasteran"
  }
}
