{
  "@context": "https://www.3se.info/3se-onto/contexts/property.context.jsonld",
  "@type": "rdf:Property",
  "title": "isSupporting - 3SE",
  "description": "Relates a role to a concept to which the role contributes resources, expertise, or effort without bearing primary responsibility or accountability for it.",
  "domain": "https://www.3se.info/3se-onto/terms/role-3se-069c451bef157773",
  "range": "skos:Concept",
  "subPropertyOf": "https://www.w3.org/ns/prov#wasAssociatedWith",
  "status": "draft"
}