{
  "@context": "https://www.3se.info/3se-onto/contexts/property.context.jsonld",
  "@type": "rdf:Property",
  "title": "canBe - 3SE",
  "description": "Relates a source concept to a target concept which may, under certain conditions, be an instance or a realisation of the source concept.\nThis relation expresses a potential, contingent relationship between two concepts.",
  "domain": "skos:Concept",
  "range": "skos:Concept",
  "status": "approved",
  "@id": "https://www.3se.info/3se-onto/properties/can-be-3se-069c8410611d7975",
  "entryCreated": "2026-03-28",
  "entryModified": "2026-09-11",
  "entryCreator": {
    "@type": "foaf:Person",
    "name": "@rcasteran"
  }
}
